{
  "schemaVersion": "1.0.0",
  "indexId": "us-composite",
  "indexName": "US Composite Index",
  "indexType": "preset",
  "baseValue": 100,
  "description": "Broad composite index tracking all major US economic sectors including defense, energy, technology, finance, consumer goods, healthcare, infrastructure, and mining.",
  "constituentTickers": [
    { "tickerId": "us-defense", "exchangeId": "nyse", "weight": 0.125 },
    { "tickerId": "us-energy", "exchangeId": "nyse", "weight": 0.125 },
    { "tickerId": "us-technology", "exchangeId": "nyse", "weight": 0.125 },
    { "tickerId": "us-finance", "exchangeId": "nyse", "weight": 0.125 },
    { "tickerId": "us-consumer", "exchangeId": "nyse", "weight": 0.125 },
    { "tickerId": "us-healthcare", "exchangeId": "nyse", "weight": 0.125 },
    { "tickerId": "us-infrastructure", "exchangeId": "nyse", "weight": 0.125 },
    { "tickerId": "us-mining", "exchangeId": "nyse", "weight": 0.125 }
  ]
}
