{
  "schemaVersion": "1.0.0",
  "indexId": "global-composite",
  "indexName": "Global Composite Index",
  "indexType": "preset",
  "baseValue": 100,
  "description": "Market-cap-weighted composite of all listed tickers across all 8 exchanges. Weights reflect approximate real-world exchange market capitalization proportions (NYSE ~$28T, SSE ~$6.9T, Euronext ~$5.8T, TSE ~$5.6T, MOEX ~$0.6T, TEDPIX ~$0.15T, PSE/DSE negligible).",
  "constituentTickers": [
    { "tickerId": "us-defense", "exchangeId": "nyse", "weight": 0.0653 },
    { "tickerId": "us-energy", "exchangeId": "nyse", "weight": 0.0653 },
    { "tickerId": "us-technology", "exchangeId": "nyse", "weight": 0.0653 },
    { "tickerId": "us-finance", "exchangeId": "nyse", "weight": 0.0653 },
    { "tickerId": "us-consumer", "exchangeId": "nyse", "weight": 0.0653 },
    { "tickerId": "us-healthcare", "exchangeId": "nyse", "weight": 0.0653 },
    { "tickerId": "us-infrastructure", "exchangeId": "nyse", "weight": 0.0653 },
    { "tickerId": "us-mining", "exchangeId": "nyse", "weight": 0.0653 },
    { "tickerId": "cn-defense", "exchangeId": "sse", "weight": 0.0222 },
    { "tickerId": "cn-energy", "exchangeId": "sse", "weight": 0.0222 },
    { "tickerId": "cn-technology", "exchangeId": "sse", "weight": 0.0222 },
    { "tickerId": "cn-finance", "exchangeId": "sse", "weight": 0.0222 },
    { "tickerId": "cn-consumer", "exchangeId": "sse", "weight": 0.0222 },
    { "tickerId": "cn-healthcare", "exchangeId": "sse", "weight": 0.0222 },
    { "tickerId": "cn-infrastructure", "exchangeId": "sse", "weight": 0.0222 },
    { "tickerId": "cn-mining", "exchangeId": "sse", "weight": 0.0222 },
    { "tickerId": "ru-defense", "exchangeId": "moex", "weight": 0.0025 },
    { "tickerId": "ru-energy", "exchangeId": "moex", "weight": 0.0025 },
    { "tickerId": "ru-technology", "exchangeId": "moex", "weight": 0.0025 },
    { "tickerId": "ru-finance", "exchangeId": "moex", "weight": 0.0025 },
    { "tickerId": "ru-consumer", "exchangeId": "moex", "weight": 0.0025 },
    { "tickerId": "ru-healthcare", "exchangeId": "moex", "weight": 0.0025 },
    { "tickerId": "ru-mining", "exchangeId": "moex", "weight": 0.0025 },
    { "tickerId": "jp-defense", "exchangeId": "tse", "weight": 0.0162 },
    { "tickerId": "jp-energy", "exchangeId": "tse", "weight": 0.0162 },
    { "tickerId": "jp-technology", "exchangeId": "tse", "weight": 0.0162 },
    { "tickerId": "jp-finance", "exchangeId": "tse", "weight": 0.0162 },
    { "tickerId": "jp-consumer", "exchangeId": "tse", "weight": 0.0162 },
    { "tickerId": "jp-healthcare", "exchangeId": "tse", "weight": 0.0162 },
    { "tickerId": "jp-infrastructure", "exchangeId": "tse", "weight": 0.0162 },
    { "tickerId": "jp-mining", "exchangeId": "tse", "weight": 0.0162 },
    { "tickerId": "ir-defense", "exchangeId": "tedpix", "weight": 0.0006 },
    { "tickerId": "ir-energy", "exchangeId": "tedpix", "weight": 0.0006 },
    { "tickerId": "ir-technology", "exchangeId": "tedpix", "weight": 0.0006 },
    { "tickerId": "ir-finance", "exchangeId": "tedpix", "weight": 0.0006 },
    { "tickerId": "ir-consumer", "exchangeId": "tedpix", "weight": 0.0006 },
    { "tickerId": "ir-mining", "exchangeId": "tedpix", "weight": 0.0006 },
    { "tickerId": "kp-defense", "exchangeId": "pse", "weight": 0.0001 },
    { "tickerId": "kp-energy", "exchangeId": "pse", "weight": 0.0001 },
    { "tickerId": "kp-consumer", "exchangeId": "pse", "weight": 0.0001 },
    { "tickerId": "kp-infrastructure", "exchangeId": "pse", "weight": 0.0001 },
    { "tickerId": "kp-mining", "exchangeId": "pse", "weight": 0.0001 },
    { "tickerId": "eu-defense", "exchangeId": "euronext", "weight": 0.0186 },
    { "tickerId": "eu-energy", "exchangeId": "euronext", "weight": 0.0186 },
    { "tickerId": "eu-technology", "exchangeId": "euronext", "weight": 0.0186 },
    { "tickerId": "eu-finance", "exchangeId": "euronext", "weight": 0.0186 },
    { "tickerId": "eu-consumer", "exchangeId": "euronext", "weight": 0.0186 },
    { "tickerId": "eu-healthcare", "exchangeId": "euronext", "weight": 0.0186 },
    { "tickerId": "eu-infrastructure", "exchangeId": "euronext", "weight": 0.0186 },
    { "tickerId": "eu-mining", "exchangeId": "euronext", "weight": 0.0186 },
    { "tickerId": "sy-defense", "exchangeId": "dse", "weight": 0.0001 },
    { "tickerId": "sy-energy", "exchangeId": "dse", "weight": 0.0001 },
    { "tickerId": "sy-consumer", "exchangeId": "dse", "weight": 0.0001 },
    { "tickerId": "sy-infrastructure", "exchangeId": "dse", "weight": 0.0001 },
    { "tickerId": "sy-mining", "exchangeId": "dse", "weight": 0.0001 }
  ]
}
