{
  "schemaVersion": "1.0.0",
  "indexId": "iran-composite",
  "indexName": "Iran Composite Index",
  "indexType": "preset",
  "baseValue": 100,
  "description": "Broad composite index tracking all major Iranian economic sectors including defense, energy, technology, finance, consumer goods, and mining.",
  "constituentTickers": [
    { "tickerId": "ir-defense", "exchangeId": "tedpix", "weight": 0.1667 },
    { "tickerId": "ir-energy", "exchangeId": "tedpix", "weight": 0.1667 },
    { "tickerId": "ir-technology", "exchangeId": "tedpix", "weight": 0.1667 },
    { "tickerId": "ir-finance", "exchangeId": "tedpix", "weight": 0.1667 },
    { "tickerId": "ir-consumer", "exchangeId": "tedpix", "weight": 0.1667 },
    { "tickerId": "ir-mining", "exchangeId": "tedpix", "weight": 0.1667 }
  ]
}
