{
  "schemaVersion": "1.0.0",
  "indexId": "global-energy",
  "indexName": "Global Energy Index",
  "indexType": "preset",
  "baseValue": 100,
  "description": "Tracks global energy sector performance weighted by production capacity",
  "constituentTickers": [
    { "tickerId": "ru-energy", "exchangeId": "moex", "weight": 0.25 },
    { "tickerId": "us-energy", "exchangeId": "nyse", "weight": 0.20 },
    { "tickerId": "ir-energy", "exchangeId": "tedpix", "weight": 0.15 },
    { "tickerId": "cn-energy", "exchangeId": "sse", "weight": 0.15 },
    { "tickerId": "eu-energy", "exchangeId": "euronext", "weight": 0.10 },
    { "tickerId": "jp-energy", "exchangeId": "tse", "weight": 0.05 },
    { "tickerId": "sy-energy", "exchangeId": "dse", "weight": 0.05 },
    { "tickerId": "kp-energy", "exchangeId": "pse", "weight": 0.05 }
  ]
}
